handle,title,category
baby-pink-cotton-floral-printed-saree-4957s7148,Baby Pink Cotton Floral Printed Saree,
beige-cotton-floral-printed-saree-4835s165,Beige  Cotton Floral Printed Saree,
beige-cotton-printed-woven-saree-4892s882,Beige Cotton Printed Woven Saree,
beige-cotton-printed-woven-saree-4893s892,Beige Cotton Printed Woven Saree,
beige-cotton-printed-woven-saree-4893s895,Beige Cotton Printed Woven Saree,
beige-cotton-woven-banarasi-saree-70073s171,Beige Cotton Woven Banarasi Saree,
beige-cotton-woven-banarasi-saree-70073s172,Beige Cotton Woven Banarasi Saree,
beige-linen-floral-printed-kalamkari-saree-4362s364,Beige Linen Floral Printed Kalamkari Saree,
beige-linen-kalamkari-saree-4364s396,Beige Linen Kalamkari Saree,
beige-shimmer-silk-printed-kalamkari-saree-4529s527,Beige Shimmer Silk Printed Kalamkari Saree,
beige-silk-printed-saree-70078s226,Beige Silk Printed Saree,
beige-silk-woven-printed-saree-70082s261,Beige Silk Woven Printed Saree,
black-chiffon-floral-printed-saree-4473s231,Black Chiffon Floral Printed Saree,
black-chiffon-printed-saree-4473s237,Black Chiffon Printed Saree,
black-cotton-blend-ikkat-printed-saree-4359s291,Black Cotton Blend Ikkat Printed Saree,
black-cotton-blend-ikkat-printed-saree-4359s298,Black Cotton Blend Ikkat Printed Saree,
black-cotton-printed-saree-3999s124,Black Cotton Blend Printed Saree,
black-cotton-dyed-self-woven-blouse-73b1229,Black Cotton Dyed Self Woven Blouse,
black-cotton-plain-plain-blouse-52b776,Black Cotton Plain Plain Blouse,
black-cotton-printed-saree-4313s104,Black Cotton Printed Saree,
black-cotton-printed-saree-4510s155,Black Cotton Printed Saree,
black-georgette-foil-printed-saree-4402s3152,Black Georgette Foil Printed Saree,
red-georgette-lace-bandhani-saree-4132s137,Black Georgette Lace Bandhani Saree,
black-lycra-plain-elastic-waist-shapewear-754swtk310,Black Lycra Plain Elastic Waist Shapewear,
black-satin-printed-saree-4733s6998,Black Satin Printed Saree,
black-silk-plain-embroidery-blouse-55b833,Black Silk Plain Embroidery Blouse,
black-silk-plain-embroidery-blouse-56b858,Black Silk Plain Embroidery Blouse,
black-silk-plain-sequence-blouse-53b805,Black Silk Plain Sequence Blouse,
black-silk-sequence-embroidery-blouse-51b766,Black Silk Sequence Embroidery Blouse,
black-silk-woven-banarasi-saree-3952s466,Black Silk Woven Banarasi Saree,
black-silk-woven-banarasi-saree-70062s134,Black Silk Woven Banarasi Saree,
black-silk-woven-paithani-saree-4360s937,Black Silk Woven Paithani Saree,
black-silk-woven-paithani-saree-5168s134,Black Silk Woven Paithani Saree,
black-silk-woven-paithani-saree-5171s1271,Black Silk Woven Paithani Saree,
black-vichitra-silk-printed-saree-4310s262,Black Vichitra Silk Printed Saree,
black-vichitra-silk-printed-saree-4310s264,Black Vichitra Silk Printed Saree,
blue-chiffon-bandhani-printed-lace-saree-4989s143,Blue Chiffon Bandhani Printed Lace Saree,
blue-cotton-printed-woven-saree-4893s891,Blue Cotton Printed Woven Saree,
blue-georgette-printed-bandhani-saree-4486s553,Blue Georgette Printed Bandhani Saree,
blue-georgette-printed-saree-4466s3187,Blue Georgette Printed Saree,
blue-linen-ikkat-printed-saree-4409s448,Blue Linen Ikkat Printed Saree,
blue-linen-ikkat-printed-saree-4409s452,Blue Linen Ikkat Printed Saree,
blue-shimmer-silk-printed-kalamkari-saree-4528s516,Blue Shimmer Silk Printed Kalamkari Saree,
blue-silk-printed-saree-4492s362,Blue Silk Printed Saree,
blue-silk-printed-saree-4492s366,Blue Silk Printed Saree,
blue-woven-banarasi-silk-saree-lfharispari7385,Blue Silk Woven Banarasi Saree,
blue-tussar-silk-printed-kalamkari-saree-4306s342,Blue Tussar Silk Printed Kalamkari Saree,
bright-yellow-cotton-printed-saree-4592s185,Bright Yellow Cotton Printed Saree,
brown-chiffon-ikkat-printed-saree-4157s113,Brown Chiffon Ikkat Printed Saree,
brown-cotton-blend-ikkat-printed-saree-4359s294,Brown Cotton Blend Ikkat Printed Saree,
brown-cotton-printed-woven-saree-4892s886,Brown Cotton Printed Woven Saree,
brown-linen-kalamkari-saree-4363s386,Brown Linen Kalamkari Saree,
brown-silk-sequence-embroidery-lace-saree-70005s111,Brown Silk Sequence Embroidery Lace Saree,
brown-tissue-silk-woven-saree-70080s243,Brown Tissue Silk Woven Saree,
copper-tissue-silk-woven-saree-70080s241,Copper Tissue Silk Woven Saree,
coral-pink-tissue-silk-sequence-embroidery-saree-4981s853,Coral Pink Tissue Silk Sequence Embroidery Saree,
coral-pink-tissue-silk-woven-saree-70080s242,Coral Pink Tissue Silk Woven Saree,
coral-pink-tissue-silk-woven-saree-70080s244,Coral Pink Tissue Silk Woven Saree,
coral-pink-tissue-silk-woven-saree-70083s274,Coral Pink Tissue Silk Woven Saree,
coral-red-shimmer-silk-printed-kalamkari-saree-4531s541,Coral Red Shimmer Silk Printed Kalamkari Saree,
cream-cotton-woven-banarasi-saree-70073s176,Cream Cotton Woven Banarasi Saree,
cream-linen-kalamkari-saree-4364s399,Cream Linen Kalamkari Saree,
cream-linen-printed-saree-4300s337,Cream Linen Printed Saree,
beige-lycra-plain-elastic-waist-shapewear-754swtk303,Cream Lycra Plain Elastic Waist Shapewear,
cream-silk-woven-banarasi-saree-4949s1231,Cream Silk Woven Banarasi Saree,
cream-silk-woven-banarasi-saree-4949s1233,Cream Silk Woven Banarasi Saree,
cream-woven-kanjivaram-silk-saree-3933s492,Cream Woven Kanjivaram Silk Saree,
dark-blue-bhagalpuri-silk-printed-saree-4160s229,Dark Blue Bhagalpuri Silk Printed Saree,
dark-blue-cotton-blend-ikkat-printed-saree-4359s292,Dark Blue Cotton Blend Ikkat Printed Saree,
dark-blue-cotton-dyed-self-woven-blouse-73b1238,Dark Blue Cotton Dyed Self Woven Blouse,
dark-blue-cotton-ikkat-printed-saree-4347s134,Dark Blue Cotton Ikkat Printed Saree,
dark-green-chiffon-printed-bandhani-saree-4156s102,Dark Green Chiffon Printed Bandhani Saree,
dark-green-cotton-blend-ikkat-printed-saree-4359s300,Dark Green Cotton Blend Ikkat Printed Saree,
dark-green-georgette-bandhani-printed-lace-saree-4986s113,Dark Green Georgette Bandhani Printed Lace Saree,
dark-green-georgette-foil-printed-saree-4402s3154,Dark Green Georgette Foil Printed Saree,
dark-green-lycra-plain-elastic-waist-shapewear-754swtk308,Dark Green Lycra Plain Elastic Waist Shapewear,
dark-green-lycra-plain-elastic-waist-shapewear-755swtk408,Dark Green Lycra Plain Elastic Waist Shapewear,
dark-green-silk-woven-banarasi-saree-3952s462,Dark Green Silk Woven Banarasi Saree,
dark-green-silk-woven-banarasi-saree-4640s133,Dark Green Silk Woven Banarasi Saree,
dark-green-silk-woven-banarasi-saree-70062s133,Dark Green Silk Woven Banarasi Saree,
dark-green-silk-woven-paithani-saree-5167s1262,Dark Green Silk Woven Paithani Saree,
dark-green-silk-woven-paithani-saree-5171s1273,Dark Green Silk Woven Paithani Saree,
dark-grey-lycra-plain-elastic-waist-shapewear-754swtk313,Dark Grey Lycra Plain Elastic Waist Shapewear,
dark-grey-lycra-plain-elastic-waist-shapewear-755swtk413,Dark Grey Lycra Plain Elastic Waist Shapewear,
dark-magenta-silk-woven-banarasi-saree-4338s669,Dark Magenta Silk Woven Banarasi Saree,
dark-maroon-cotton-lycra-dyed-self-woven-blouse-73b1255,Dark Maroon Cotton Lycra Dyed Self Woven Blouse,
dark-navy-blue-tussar-silk-printed-kalamkari-saree-4295s272,Dark Navy Blue Tussar Silk Printed Kalamkari Saree,
dark-oilve-green-tissue-silk-woven-saree-70083s273,Dark Oilve Green Tissue Silk Woven Saree,
dark-pink-georgette-bandhani-printed-lace-saree-4986s111,Dark Pink Georgette Bandhani Printed Lace Saree,
dark-pink-shimmer-stone-work-swarovski-saree-70029s124,Dark Pink Shimmer Stone Work Swarovski Saree,
dark-pink-silk-woven-paithani-saree-5168s135,Dark Pink Silk Woven Paithani Saree,
dark-pink-silk-woven-patola-saree-70077s214,Dark Pink Silk Woven Patola Saree,
dark-purple-satin-sequence-embroidery-saree-4858s172,Dark Purple Satin Sequence Embroidery  Saree,
dark-purple-silk-woven-banarasi-saree-70031s111,Dark Purple Silk Woven Banarasi Saree,
dark-purple-silk-woven-paithani-saree-4547s6904,Dark Purple Silk Woven Paithani Saree,
dark-purple-silk-woven-paithani-saree-5005s7162,Dark Purple Silk Woven Paithani Saree,
dark-purple-silk-woven-paithani-saree-5006s7175,Dark Purple Silk Woven Paithani Saree,
dark-purple-silk-woven-paithani-saree-70061s122,Dark Purple Silk Woven Paithani Saree,
dark-purple-silk-woven-banarasi-saree-3990s153,Dark Purple Woven Banarasi Silk Saree,
blue-silk-woven-saree-3748s465,Dark Rama Blue Silk Woven Banarasi Saree,
dusty-beige-chiffon-woven-border-saree-5188s1259,Dusty Beige Chiffon Woven Border Saree,
dusty-blue-shimmer-silk-printed-kalamkari-saree-4526s497,Dusty Blue Shimmer Silk Printed Kalamkari Saree,
dusty-blue-tussar-silk-printed-kalamkari-saree-4293s252,Dusty Blue Tussar Silk Printed Kalamkari Saree,
dusty-brown-georgette-bandhani-printed-lace-saree-4986s112,Dusty Brown Georgette Bandhani Printed Lace Saree,
dusty-green-linen-kalamkari-saree-4364s391,Dusty Green Linen Kalamkari Saree,
dusty-pink-lycra-plain-elastic-waist-shapewear-754swtk309,Dusty Pink Lycra Plain Elastic Waist Shapewear,
dusty-pink-lycra-plain-elastic-waist-shapewear-755swtk409,Dusty Pink Lycra Plain Elastic Waist Shapewear,
dusty-purple-cotton-woven-printed-saree-4933s931,Dusty Purple Cotton Woven Printed Saree,
dusty-purple-tussar-silk-printed-kalamkari-saree-4298s305,Dusty Purple Tussar Silk Printed Kalamkari Saree,
dusty-rama-blue-linen-floral-printed-saree-4362s361,Dusty Rama Blue Linen Floral Printed Saree,
dusty-rose-pink-cotton-woven-banarasi-saree-70073s175,Dusty Rose Pink Cotton Woven Banarasi Saree,
dusty-teal-blue-shimmer-embroidery-saree-70004s102,Dusty Teal Blue Shimmer Embroidery Saree,
dusty-teal-blue-shimmer-sequence-embroidery-saree-5025s111,Dusty Teal Blue Shimmer Sequence Embroidery Saree,
dusty-wine-linen-kalamkari-saree-4364s395,Dusty Wine Linen Kalamkari Saree,
gold-tissue-silk-woven-saree-70083s271,Gold Tissue Silk Woven Saree,
golden-cotton-silk-embroidery-saree-4955s281,Golden Cotton Silk Embroidery Saree,
golden-silk-plain-embroidery-blouse-55b832,Golden Silk Plain Embroidery Blouse,
green-chiffon-bandhani-printed-lace-saree-4989s142,Green Chiffon Bandhani Printed Lace Saree,
green-georgette-printed-bandhani-saree-4486s554,Green Georgette Printed Bandhani Saree,
green-georgette-printed-bandhani-saree-4486s555,Green Georgette Printed Bandhani Saree,
green-georgette-printed-saree-70084s212,Green Georgette Printed Saree,
green-silk-woven-banarasi-saree-70049s105,Green Silk Woven Banarasi Saree,
green-silk-woven-banarasi-saree-70050s113,Green Silk Woven Banarasi Saree,
green-silk-woven-banarasi-saree-70052s131,Green Silk Woven Banarasi Saree,
green-silk-woven-paithani-saree-5005s7161,Green Silk Woven Paithani Saree,
green-silk-woven-patola-saree-4516s6864,Green Silk Woven Patola Saree,
grey-cotton-blend-ikkat-printed-saree-4353s283,Grey Cotton Blend Ikkat Printed Saree,
grey-cotton-blend-ikkat-printed-saree-4353s284,Grey Cotton Blend Ikkat Printed Saree,
grey-cotton-blend-ikkat-printed-saree-4353s285,Grey Cotton Blend Ikkat Printed Saree,
grey-cotton-dyed-self-woven-blouse-73b1243,Grey Cotton Dyed Self Woven Blouse,
grey-cotton-printed-woven-saree-4892s884,Grey Cotton Printed Woven Saree,
grey-cotton-woven-banarasi-saree-70073s173,Grey Cotton Woven Banarasi Saree,
grey-cotton-woven-printed-saree-4933s933,Grey Cotton Woven Printed Saree,
grey-linen-ikkat-printed-saree-4409s447,Grey Linen Ikkat Printed Saree,
grey-linen-kalamkari-saree-4362s367,Grey Linen Kalamkari Saree,
grey-linen-kalamkari-saree-4393s416,Grey Linen Kalamkari Saree,
grey-silk-printed-saree-70079s235,Grey Silk Printed Saree,
grey-silk-woven-printed-saree-70082s264,Grey Silk Woven Printed Saree,
grey-tissue-silk-woven-saree-70080s246,Grey Tissue Silk Woven Saree,
white-linen-printed-saree-5052s549,Holi White Linen Printed Saree,
brown-silk-woven-saree-3759s134,Khaki Silk Woven Banarasi Saree,
khaki-silk-woven-kanjivaram-saree-4945s241,Khaki Silk Woven Kanjivaram Saree,
khaki-vichitra-silk-sequence-embroidery-lace-saree-5015s3582,Khaki Vichitra Silk Sequence Embroidery Lace Saree,
lavender-chiffon-woven-border-saree-5188s1253,Lavender Chiffon Woven Border Saree,
lavender-shimmer-embroidery-saree-70006s123,Lavender Shimmer Embroidery Saree,
lavender-shimmer-tissue-sequence-embroidery-saree-5056s7213,Lavender Shimmer Tissue Sequence Embroidery Saree,
lavender-shimmer-tissue-sequence-embroidery-saree-70012s112,Lavender Shimmer Tissue Sequence Embroidery Saree,
lavender-silk-woven-saree-4910s905,Lavender Silk Woven Paithani Saree,
light-beige-cotton-dyed-self-woven-blouse-73b1249,Light Beige Cotton Dyed Self Woven Blouse,
light-beige-tussar-silk-printed-kalamkari-saree-4298s301,Light Beige Tussar Silk Printed Kalamkari Saree,
light-blue-chanderi-woven-saree-4357s647,Light Blue Chanderi Woven Saree,
light-blue-cotton-dyed-self-woven-blouse-73b1241,Light Blue Cotton Dyed Self Woven Blouse,
light-blue-silk-woven-printed-saree-70082s266,Light Blue Silk Woven Printed Saree,
light-brown-linen-printed-saree-4299s316,Light Brown Linen Printed Saree,
light-brown-silk-printed-saree-70079s231,Light Brown Silk Printed Saree,
light-brown-silk-woven-kanjivaram-saree-4945s243,Light Brown Silk Woven Kanjivaram Saree,
light-green-cotton-dyed-self-woven-blouse-73b1245,Light Green Cotton Dyed Self Woven Blouse,
light-green-cotton-floral-printed-saree-4957s7142,Light Green Cotton Floral Printed Saree,
light-green-lycra-plain-elastic-waist-shapewear-754swtk305,Light Green Lycra Plain Elastic Waist Shapewear,
light-green-lycra-plain-elastic-waist-shapewear-755swtk405,Light Green Lycra Plain Elastic Waist Shapewear,
light-khaki-tussar-silk-printed-kalamkari-saree-4312s357,Light Khaki Tussar Silk Printed Kalamkari Saree,
light-mauve-silk-printed-saree-70079s233,Light Mauve Silk Printed Saree,
light-mint-green-cotton-dyed-self-woven-blouse-73b1230,Light Mint Green Cotton Dyed Self Woven Blouse,
light-navy-blue-shimmer-silk-printed-kalamkari-saree-4526s498,Light Navy Blue Shimmer Silk Printed Kalamkari Saree,
light-olive-green-silk-printed-saree-70078s225,Light Olive Green Silk Printed Saree,
light-peach-linen-printed-kalamkari-saree-4403s387,Light Peach Linen Printed Kalamkari Saree,
light-peach-silk-woven-printed-saree-70082s262,Light Peach Silk Woven Printed Saree,
light-pink-cotton-dyed-self-woven-blouse-73b1251,Light Pink Cotton Dyed Self Woven Blouse,
light-pink-georgette-foil-printed-saree-4443s334,Light Pink Georgette Foil Printed Saree,
light-pink-linen-ikkat-printed-saree-4409s449,Light Pink Linen Ikkat Printed Saree,
light-salmon-pink-silk-woven-banarasi-saree-3989s146,Light Salmon Pink Silk Woven Banarasi Saree,
light-yellow-cotton-printed-saree-4957s7149,Light Yellow Cotton Printed Saree,
light-yellow-silk-printed-saree-70078s222,Light Yellow Silk Printed Saree,
light-yellow-silk-woven-printed-saree-70082s265,Light Yellow Silk Woven Printed Saree,
lime-yellow-silk-woven-kanjivaram-saree-4954s271,Lime Green Silk Woven Kanjivaram Saree,
lime-green-silk-woven-paithani-saree-5172s1282,Lime Green Silk Woven Paithani Saree,
lime-yellow-cotton-printed-saree-4957s7146,Lime Yellow Cotton Printed Saree,
magenta-chiffon-bandhani-printed-lace-saree-4988s132,Magenta Chiffon Bandhani Printed Lace Saree,
magenta-silk-woven-sarees-3522s1121,Magenta Paithani Silk Woven Saree,
maroon-chiffon-stone-work-swarovski-saree-5058s982,Maroon Chiffon Stone Work Swarovski Saree,
maroon-chiffon-stone-work-swarovski-saree-5059s994,Maroon Chiffon Stone Work Swarovski Saree,
maroon-cotton-dyed-self-woven-blouse-73b1239,Maroon Cotton Dyed Self Woven Blouse,
maroon-georgette-bandhani-printed-lace-saree-4986s114,Maroon Georgette Bandhani Printed Lace Saree,
maroon-georgette-printed-bandhani-saree-4785s121,Maroon Georgette Printed Bandhani Saree,
maroon-silk-plain-sequence-blouse-53b810,Maroon Silk Plain Sequence Blouse,
maroon-silk-sequence-embroidery-blouse-51b765,Maroon Silk Sequence Embroidery Blouse,
brown-woven-silk-saree-3412s157,Maroon Silk Woven Banarasi Saree,
maroon-silk-woven-banarasi-saree-4872s964,Maroon Silk Woven Banarasi Saree,
maroon-silk-woven-banarasi-saree-5113s101,Maroon Silk Woven Banarasi Saree,
maroon-silk-woven-banarasi-saree-70050s112,Maroon Silk Woven Banarasi Saree,
maroon-silk-woven-banarasi-saree-70032s122,Maroon Silk Woven Kanjivaram Saree,
mauve-cotton-blend-ikkat-printed-saree-4353s286,Mauve Cotton Blend Ikkat Printed Saree,
mauve-georgette-printed-saree-70084s211,Mauve Georgette Printed Saree,
mauve-vichitra-silk-printed-saree-4898s1121,Mauve Vichitra Silk Printed Saree,
mehandi-green-cotton-dyed-self-woven-blouse-73b1242,Mehandi Green Cotton Dyed Self Woven Blouse,
mehandi-green-net-sequence-embroidery-saree-70003s101,Mehandi Green Net Sequence Embroidery Saree,
mehndi-green-silk-printed-saree-70079s234,Mehndi Green Silk Printed Saree,
mint-green-cotton-silk-embroidery-saree-4955s282,Mint Green Cotton Silk Embroidery Saree,
mint-green-cotton-woven-banarasi-saree-70073s174,Mint Green Cotton Woven Banarasi Saree,
mint-green-silk-woven-saree-4910s901,Mint Green Silk Woven Paithani Saree,
moss-green-tissue-silk-woven-saree-70080s245,Moss Green Tissue Silk Woven Saree,
moss-green-tissue-silk-woven-saree-70083s276,Moss Green Tissue Silk Woven Saree,
purple-silk-woven-banarasi-saree-4498s757,Mouni Roy Blue Kashish Banarasi Saree,
red-chiffon-embroidery-saree-4488s233,Mouni Roy Crimson Rose Zari Embroidery Saree,
navy-blue-organza-printed-swarovski-saree-4708s626,Mouni Roy Midnight Blue Gold Swarovski Saree,
rani-pink-silk-woven-banarasi-saree-4548s1026,Mouni Roy Rani Pink Peacock Banarasi Saree,
grey-silk-printed-saree-4709s426,Mouni Roy Rusty Grey Terracotta Silk Saree,
mustard-yellow-cotton-printed-saree-4313s108,Multicoloured Cotton Printed Saree,
multicoloured-georgette-bandhani-printed-lace-saree-4987s121,Multicoloured Georgette Bandhani Printed Lace Saree,
mustard-yellow-tussar-silk-printed-kalamkari-saree-4312s354,Mustard Green Tussar Silk Printed Kalamkari Saree,
mustard-lycra-plain-elastic-waist-shapewear-755swtk402,Mustard Lycra Plain Elastic Waist Shapewear,
navy-blue-coloured-lycra-solid-saree-shapewear-slv180tk112,Navy Blue Coloured Lycra Solid Saree Shapewear,
navy-blue-cotton-blend-bandhani-printed-saree-4368s329,Navy Blue Cotton Blend Bandhani Printed Saree,
navy-blue-cotton-dyed-self-woven-blouse-73b1228,Navy Blue Cotton Dyed Self Woven Blouse,
navy-blue-cotton-floral-printed-saree-4942s969,Navy Blue Cotton Floral Printed Saree,
navy-blue-lycra-plain-elastic-waist-shapewear-754swtk311,Navy Blue Lycra Plain Elastic Waist Shapewear,
navy-blue-silk-woven-banarasi-saree-5113s102,Navy Blue Silk Woven Banarasi Saree,
navy-blue-silk-woven-banarasi-saree-70062s132,Navy Blue Silk Woven Banarasi Saree,
navy-blue-silk-woven-banarasi-saree-70062s135,Navy Blue Silk Woven Banarasi Saree,
navy-blue-silk-woven-paithani-saree-4360s936,Navy Blue Silk Woven Paithani Saree,
navy-blue-silk-woven-paithani-saree-5172s1286,Navy Blue Silk Woven Paithani Saree,
off-white-cotton-dyed-self-woven-blouse-73b1226,Off White Cotton Dyed Self Woven Blouse,
off-white-cotton-floral-printed-saree-4956s1274,Off White Cotton Floral Printed Saree,
off-white-cotton-printed-saree-4956s1271,Off White Cotton Printed Saree,
off-white-linen-ikkat-printed-saree-4409s445,Off White Linen Ikkat Printed Saree,
off-white-linen-printed-saree-4263s123,Off White Linen Printed Saree,
off-white-silk-warli-printed-printed-saree-4310s265,Off White Silk Warli Printed Saree,
olive-green-linen-ikkat-printed-saree-4409s453,Olive Green Linen Ikkat Printed Saree,
olive-green-lycra-plain-elastic-waist-shapewear-754swtk307,Olive Green Lycra Plain Elastic Waist Shapewear,
olive-green-lycra-plain-elastic-waist-shapewear-755swtk407,Olive Green Lycra Plain Elastic Waist Shapewear,
orange-cotton-dyed-self-woven-blouse-73b1240,Orange Cotton Dyed Self Woven Blouse,
orange-cotton-ikkat-printed-saree-4313s107,Orange Cotton Ikkat Printed Saree,
orange-cotton-printed-saree-4510s152,Orange Cotton Printed Saree,
orange-georgette-bandhani-printed-lace-saree-4987s123,Orange Georgette Bandhani Printed Lace Saree,
orange-georgette-bandhani-printed-lace-saree-5017s782,Orange Georgette Bandhani Printed Lace Saree,
orange-georgette-printed-saree-70084s213,Orange Georgette Printed Saree,
orange-vichitra-silk-sequence-embroidery-lace-saree-5015s3581,Orange Vichitra Silk Sequence Embroidery Lace Saree,
parrot-green-silk-woven-banarasi-saree-70034s141,Parrot Green Silk Woven Banarasi Saree,
parrot-green-tissue-silk-woven-saree-70081s256,Parrot Green Tissue Silk Woven Saree,
peach-cotton-dyed-self-woven-blouse-73b1232,Peach Cotton Dyed Self Woven Blouse,
peach-crepe-printed-saree-5189s1173,Peach Crepe Printed Saree,
peach-georgette-printed-saree-70084s214,Peach Georgette Printed Saree,
peach-silk-printed-saree-70078s221,Peach Silk Printed Saree,
peach-silk-woven-kanjivaram-saree-4949s1232,Peach Silk Woven Kanjivaram Saree,
pink-chiffon-bandhani-printed-lace-saree-4989s144,Pink Chiffon Bandhani Printed Lace Saree,
pink-cotton-printed-woven-saree-4893s896,Pink Cotton Printed Woven Saree,
pink-linen-ikkat-printed-saree-4409s441,Pink Linen Ikkat Printed Saree,
pink-linen-ikkat-printed-saree-4409s442,Pink Linen Ikkat Printed Saree,
pink-lycra-plain-elastic-waist-shapewear-754swtk301,Pink Lycra Plain Elastic Waist Shapewear,
pink-lycra-plain-elastic-waist-shapewear-755swtk401,Pink Lycra Plain Elastic Waist Shapewear,
pink-silk-woven-saree-4722s661,Pink Silk Woven Banarasi Saree,
pink-silk-woven-banarasi-saree-70050s111,Pink Silk Woven Banarasi Saree,
pink-silk-woven-banarasi-saree-70051s121,Pink Silk Woven Banarasi Saree,
pink-silk-woven-banarasi-saree-70052s133,Pink Silk Woven Banarasi Saree,
pink-silk-woven-kanjivaram-saree-4585s1104,Pink Silk Woven Kanjivaram Saree,
beige-silk-woven-kanjivaram-saree-4946s251,Pink Silk Woven Kanjivaram Saree,
pink-silk-woven-paithani-saree-5006s7172,Pink Silk Woven Paithani Saree,
pink-tissue-silk-embroidery-embellished-saree-4929s651,Pink Tissue Silk Embroidery Embellished Saree,
pista-green-tissue-silk-woven-saree-70081s253,Pista Green Tissue Silk Woven Saree,
pista-green-tissue-silk-woven-saree-70083s275,Pista Green Tissue Silk Woven Saree,
purple-cotton-printed-saree-4510s156,Purple Cotton Printed Saree,
purple-shimmer-chiffon-lace-saree-70042s143,Purple Shimmer Chiffon Lace Saree,
purple-shimmer-sequence-embroidery-saree-4889s7131,Purple Shimmer Sequence Embroidery Saree,
purple-silk-woven-banarasi-saree-4485s985,Purple Silk Woven Banarasi Saree,
purple-silk-woven-banarasi-saree-70052s132,Purple Silk Woven Banarasi Saree,
rama-blue-georgette-printed-bandhani-saree-4832s1139,Rama Blue Georgette Printed Bandhani Saree,
rama-blue-silk-woven-banarasi-saree-3952s464,Rama Blue Silk Woven Banarasi Saree,
rama-blue-silk-woven-kanjivaram-saree,Rama Blue Silk Woven Kanjivaram Saree,
rama-blue-silk-woven-banarasi-saree-3990s152,Rama Blue Woven Banarasi Silk Saree,
rani-pink-chiffon-printed-bandhani-saree-4156s101,Rani Pink Chiffon Printed Bandhani Saree,
rani-pink-cotton-dyed-self-woven-blouse-73b1224,Rani Pink Cotton Dyed Self Woven Blouse,
rani-pink-linen-kalamkari-saree-4362s368,Rani Pink Linen Kalamkari Saree,
rani-pink-lycra-plain-elastic-waist-shapewear-755swtk406,Rani Pink Lycra Plain Elastic Waist Shapewear,
rani-pink-silk-plain-embroidery-blouse-55b840,Rani Pink Silk Plain Embroidery Blouse,
rani-pink-silk-plain-sequence-blouse-53b802,Rani Pink Silk Plain Sequence Blouse,
rani-pink-silk-woven-banarasi-saree-3990s154,Rani Pink Silk Woven Banarasi Saree,
rani-pink-silk-woven-banarasi-saree-70062s131,Rani Pink Silk Woven Banarasi Saree,
rani-pink-silk-woven-paithani-saree-70061s121,Rani Pink Silk Woven Paithani Saree,
rani-pink-silk-woven-paithani-saree-70061s123,Rani Pink Silk Woven Paithani Saree,
rani-pink-silk-woven-patola-saree-4871s951,Rani Pink Silk Woven Patola Saree,
ready-to-wear-beige-linen-floral-printed-saree-53rs115,Ready To Wear Beige Linen Floral Printed Saree,
ready-to-wear-beige-silk-printed-saree-86rs263,Ready To Wear Beige Silk Printed Saree,
ready-to-wear-blue-cotton-printed-saree-98rs235,Ready To Wear Blue Cotton Printed Saree,
ready-to-wear-blue-cotton-printed-saree-98rs241,Ready To Wear Blue Cotton Printed Saree,
ready-to-wear-cream-chanderi-cotton-printed-saree-76rs520,Ready To Wear Cream Chanderi Cotton Printed Saree,
cream-linen-printed-ready-to-wear-saree-45rs417,Ready To Wear Cream Linen Printed Saree With Pocket,
ready-to-wear-dark-beige-silk-printed-saree-77rs541,Ready To Wear Dark Beige Silk Printed Saree,
ready-to-wear-dark-blue-linen-printed-saree-with-pocket-48rs442,Ready To Wear Dark Blue Linen Printed Saree With Pocket,
ready-to-wear-dusty-orange-linen-printed-saree-84rs229,Ready To Wear Dusty Orange Linen Printed Saree,
ready-to-wear-dusty-rose-pink-chinnon-floral-printed-saree-91rs193,Ready To Wear Dusty Rose Pink Chinnon Floral Printed Saree,
ready-to-wear-dusty-wine-georgette-printed-saree-50rs145,Ready To Wear Dusty Wine Georgette Printed Saree,
ready-to-wear-dusty-wine-linen-floral-printed-saree-77rs539,Ready To Wear Dusty Wine Linen Floral Printed Saree,
ready-to-wear-dusty-wine-linen-printed-saree-83rs209,Ready To Wear Dusty Wine Linen Printed Saree,
ready-to-wear-lavender-linen-woven-border-floral-printed-saree-56rs156,Ready To Wear Lavender Linen Woven Border Floral Printed Saree,
ready-to-wear-lemon-yellow-chanderi-cotton-printed-saree-76rs518,Ready To Wear Lemon Green Chanderi Cotton Printed Saree,
ready-to-wear-light-beige-chanderi-cotton-printed-saree-76rs521,Ready To Wear Light Beige Chanderi Cotton Printed Saree,
ready-to-wear-light-peach-georgette-floral-printed-saree-58rs183,Ready To Wear Light Peach Georgette Floral Printed Saree,
ready-to-wear-light-purple-linen-printed-saree-with-pocket-48rs447,Ready To Wear Light Purple Linen Printed Saree With Pocket,
