handle,title,category
ready-to-wear-lime-green-cotton-printed-saree-98rs234,Ready To Wear Lime Green Cotton Printed Saree,
ready-to-wear-lime-yellow-cotton-printed-saree-98rs233,Ready To Wear Lime Yellow Cotton Printed Saree,
ready-to-wear-maroon-cotton-printed-saree-98rs237,Ready To Wear Maroon Cotton Printed Saree,
ready-to-wear-multicoloured-cotton-printed-saree-83rs212,Ready To Wear Multicoloured Cotton Printed Saree,
ready-to-wear-mustard-yellow-cotton-printed-saree-98rs236,Ready To Wear Mustard Yellow Cotton Printed Saree,
ready-to-wear-off-white-chinnon-printed-saree-90rs183,Ready To Wear Off White Chinnon Printed Saree,
ready-to-wear-off-white-linen-printed-saree-85rs248,Ready To Wear Off White Linen Printed Saree,
ready-to-wear-olive-green-chinnon-printed-saree-90rs182,Ready To Wear Olive Green Chinnon Printed Saree,
ready-to-wear-peach-linen-printed-saree-84rs231,Ready To Wear Peach Linen Printed Saree,
ready-to-wear-pink-cotton-printed-saree-98rs232,Ready To Wear Pink Cotton Printed Saree,
ready-to-wear-purple-cotton-printed-saree-98rs238,Ready To Wear Purple Cotton Printed Saree,
ready-to-wear-rust-cotton-printed-saree-98rs240,Ready To Wear Rust Cotton Printed Saree,
ready-to-wear-dark-pink-chinnon-floral-printed-saree-88rs163,Ready To Wear Sage Green Chinnon Floral Printed Saree,
ready-to-wear-teal-blue-cotton-printed-saree-98rs239,Ready To Wear Teal Blue Cotton Printed Saree,
ready-to-wear-white-linen-printed-saree-84rs228,Ready To Wear White Linen Printed Saree,
ready-to-wear-white-pure-cotton-printed-saree-with-pocket-40rs156,Ready To Wear White Pure Cotton Printed Saree With Pocket,
ready-to-wear-yellow-chanderi-cotton-printed-saree-76rs522,Ready To Wear Yellow Chanderi Cotton Printed Saree,
ready-to-wear-yellow-cotton-printed-saree-98rs231,Ready To Wear Yellow Cotton Printed Saree,
ready-to-wear-dark-pink-linen-floral-printed-saree-43rs385,Ready to Wear Dark Pink Linen Floral Printed Saree,
ready-to-wear-white-linen-floral-printed-saree-42rs378,Ready to Wear White Linen Floral Printed Saree,
ready-to-wear-yellow-linen-printed-saree-43rs384,Ready to Wear Yellow Linen Printed Saree,
ready-to-wear-yellow-linen-printed-saree-43rs386,Ready to Wear Yellow Linen Printed Saree,
red-chiffon-bandhani-printed-lace-saree-4989s141,Red Chiffon Bandhani Printed Lace Saree,
red-chiffon-ikkat-printed-saree-4157s114,Red Chiffon Ikkat Printed Saree,
red-cotton-dyed-self-woven-blouse-73b1247,Red Cotton Dyed Self Woven Blouse,
red-cotton-printed-saree-4313s103,Red Cotton Printed Saree,
red-georgette-printed-bandhani-saree-4303s938,Red Georgette Printed Bandhani Saree,
red-georgette-printed-bandhani-saree-4513s123,Red Georgette Printed Bandhani Saree,
red-georgette-printed-saree-4618s301,Red Georgette Printed Saree,
red-georgette-sequence-embroidery-saree-4980s251,Red Georgette Sequence Embroidery saree,
red-silk-plain-embroidery-blouse-56b853,Red Silk Plain Embroidery Blouse,
red-silk-printed-bandhani-saree-4513s112,Red Silk Printed Bandhani Saree,
red-silk-plain-saree-3649s383,Red Silk Woven Banarasi Saree,
pink-silk-woven-banarasi-saree-4110s2898,Red Silk Woven Banarasi Saree,
red-silk-woven-banarasi-saree-70054s141,Red Silk Woven Banarasi Saree,
red-silk-woven-paithani-saree-3808s558,Red Silk Woven Paithani Saree,
red-silk-woven-paithani-saree-5167s1264,Red Silk Woven Paithani Saree,
red-silk-woven-paithani-saree-5171s1277,Red Silk Woven Paithani Saree,
red-silk-woven-patola-saree-4871s953,Red Silk Woven Patola Saree,
rose-pink-cotton-blend-ikkat-printed-saree-4353s281,Rose Pink Cotton Blend Ikkat Printed Saree,
rose-pink-cotton-woven-printed-saree-4933s932,Rose Pink Cotton Woven Printed Saree,
sage-green-cotton-floral-printed-saree-4942s962,Sage Green Cotton Floral Printed Saree,
blue-silk-plain-saree-3730s390,Sea Blue Silk Woven Banarasi Saree,
turmeric-yellow-silk-woven-saree-4469s132,Shweta Tiwari Amber Yellow Banarasi Silk Saree,
pink-satin-sequence-embroidery-saree-4858s173,Shweta Tiwari Blush Pink Sequin Embroidered Silk Saree,
black-silk-foil-printed-saree-4737s502,Shweta Tiwari Midnight Black Foil Silk Saree,
ready-to-wear-wine-cotton-printed-saree-75rs192,Shweta Tiwari Plum Wine Ready To Wear Cotton Saree,
peacock-blue-shimmer-stone-work-embellished-saree-4939s951,Shweta Tiwari Sapphire Blue Swarovski Saree,
sky-blue-linen-ikkat-printed-saree-4409s446,Sky Blue Linen Ikkat Printed Saree,
sky-blue-lycra-plain-elastic-waist-shapewear-754swtk304,Sky Blue Lycra Plain Elastic Waist Shapewear,
sky-blue-lycra-plain-elastic-waist-shapewear-755swtk404,Sky Blue Lycra Plain Elastic Waist Shapewear,
sky-blue-silk-woven-banarasi-saree-3960s575,Sky Blue Silk Woven Banarasi Saree,
teal-blue-cotton-blend-bandhani-printed-saree-4368s322,Teal Blue Cotton Blend Bandhani Printed Saree,
teal-blue-cotton-dyed-self-woven-blouse-73b1221,Teal Blue Cotton Dyed Self Woven Blouse,
teal-blue-georgette-printed-saree-4918s923,Teal Blue Georgette Printed Saree,
teal-blue-linen-kalamkari-printed-saree-4363s389,Teal Blue Linen Kalamkari Printed Saree,
teal-blue-shimmer-chiffon-lace-saree-70042s141,Teal Blue Shimmer Chiffon Lace Saree,
teal-blue-shimmer-silk-printed-kalamkari-saree-4529s525,Teal Blue Shimmer Silk Printed Kalamkari Saree,
teal-blue-shimmer-tissue-sequence-embroidery-saree-70012s114,Teal Blue Shimmer Tissue Sequence Embroidery Saree,
blue-silk-woven-saree-3697s121,Teal Blue Silk Woven Banarasi Saree,
teal-blue-silk-woven-banarasi-saree-70034s142,Teal Blue Silk Woven Banarasi Saree,
teal-blue-silk-woven-banarasi-saree-70049s106,Teal Blue Silk Woven Banarasi Saree,
teal-blue-silk-woven-banarasi-saree-70051s123,Teal Blue Silk Woven Banarasi Saree,
teal-blue-silk-woven-paithani-saree-5171s1276,Teal Blue Silk Woven Paithani Saree,
teal-green-shimmer-sequence-embroidery-saree-4903s863,Teal Green Shimmer Sequence Embroidery Saree,
green-silk-woven-saree-3697s120,Teal Green Silk Woven Banarasi Saree,
teal-green-silk-woven-banarasi-saree-70051s122,Teal Green Silk Woven Banarasi Saree,
teal-green-silk-woven-paithani-saree-5005s7163,Teal Green Silk Woven Paithani Saree,
teal-green-silk-woven-paithani-saree-5168s136,Teal Green Silk Woven Paithani Saree,
teal-green-silk-woven-paithani-saree-70061s124,Teal Green Silk Woven Paithani Saree,
teal-green-silk-woven-patola-saree-70076s204,Teal Green Silk Woven Patola Saree,
teal-green-silk-woven-saree-4839s801,Teal Green Silk Woven Saree,
teal-green-tussar-silk-printed-kalamkari-saree-4294s262,Teal Green Tussar Silk Printed Kalamkari Saree,
turquoise-cotton-printed-saree-4957s7144,Turquoise Cotton Printed Saree,
turquoise-linen-ikkat-printed-saree-4409s450,Turquoise Linen Ikkat Printed Saree,
white-cotton-floral-printed-saree-4950s131,White Cotton Floral Printed Saree,
white-cotton-floral-printed-saree-4957s7150,White Cotton Floral Printed Saree,
white-cotton-floral-printed-saree-4957s7153,White Cotton Floral Printed Saree,
white-cotton-printed-saree-4956s1272,White Cotton Printed Saree,
white-cotton-printed-saree-4957s7141,White Cotton Printed Saree,
white-cotton-printed-saree-4957s7154,White Cotton Printed Saree,
ready-to-wear-beige-linen-printed-saree-4358s271,White Georgette Zari Stripe Bandhani Printed Saree,
white-linen-floral-printed-saree-4958s1281,White Linen Floral Printed Saree,
white-linen-ikkat-printed-saree-4409s444,White Linen Ikkat Printed Saree,
white-linen-printed-saree-4300s336,White Linen Printed Saree,
white-linen-printed-saree-4958s1285,White Linen Printed Saree,
white-linen-woven-saree-4943s841,White Linen Woven Saree,
white-linen-woven-saree-4943s842,White Linen Woven Saree,
white-linen-woven-saree-4943s843,White Linen Woven Saree,
white-linen-woven-saree-4943s845,White Linen Woven Saree,
white-silk-woven-kanjivaram-saree-4951s1241,White Silk Woven Kanjivaram Saree,
white-tussar-silk-printed-kalamkari-saree-4312s359,White Tussar Silk Printed Kalamkari Saree,
wine-chiffon-ikkat-printed-saree-4157s112,Wine Chiffon Ikkat Printed Saree,
wine-chiffon-sequence-embroidery-saree-5027s1171,Wine Chiffon Sequence Embroidery Saree,
wine-cotton-blend-ikkat-printed-saree-4359s293,Wine Cotton Blend Ikkat Printed Saree,
wine-cotton-blend-ikkat-printed-saree-4359s299,Wine Cotton Blend Ikkat Printed Saree,
wine-cotton-dyed-self-woven-blouse-73b1248,Wine Cotton Dyed Self Woven Blouse,
wine-cotton-plain-sequence-blouse-54b814,Wine Cotton Plain Sequence Blouse,
wine-lycra-plain-elastic-waist-shapewear-754swtk312,Wine Lycra Plain Elastic Waist Shapewear,
wine-lycra-plain-elastic-waist-shapewear-755swtk412,Wine Lycra Plain Elastic Waist Shapewear,
wine-shimmer-chiffon-sequence-embroidery-saree-4911s883,Wine Shimmer Chiffon Sequence Embroidery saree,
wine-silk-plain-embroidery-blouse-56b855,Wine Silk Plain Embroidery Blouse,
yellow-chiffon-bandhani-printed-lace-saree-4988s131,Yellow Chiffon Bandhani Printed Lace Saree,
yellow-cotton-dyed-self-woven-blouse-73b1225,Yellow Cotton Dyed Self Woven Blouse,
yellow-cotton-printed-saree-4956s1275,Yellow Cotton Printed Saree,
yellow-cotton-printed-saree-4957s7143,Yellow Cotton Printed Saree,
yellow-georgette-bandhani-printed-lace-saree-4987s122,Yellow Georgette Bandhani Printed Lace Saree,
yellow-georgette-printed-bandhani-saree-4513s124,Yellow Georgette Printed Bandhani Saree,
yellow-linen-ikkat-printed-saree-4409s451,Yellow Linen Ikkat Printed Saree,
yellow-silk-plain-embroidery-blouse-56b856,Yellow Silk Plain Embroidery Blouse,
yellow-silk-printed-saree-70079s232,Yellow Silk Printed Saree,
yellow-silk-woven-paithani-saree-4052s6354,Yellow Silk Woven Paithani Saree,
yellow-tissue-silk-woven-saree-70083s272,Yellow Tissue Silk Woven Saree,
yellow-tussar-silk-printed-kalamkari-saree-4295s275,Yellow Tussar Silk Printed Kalamkari Saree,
yellow-tussar-silk-printed-kalamkari-saree-4306s341,Yellow Tussar Silk Printed Kalamkari Saree,
